{
  "cases": {
    "f16": {
      "original_baseline": {
        "command": [
          "/workspace/k3-out-of-core/llama.cpp/build-phase11-a-cuda/bin/phase11-uma-runtime-probe",
          "--model",
          "/workspace/k3-out-of-core/models/gguf/Kimi-K3-0.40B-F16.gguf",
          "--mode",
          "disabled",
          "--steps",
          "5"
        ],
        "diagnostics": {
          "cold_actual_bytes": 0,
          "cold_alignment": 0,
          "cold_bundle_payload": 0,
          "cold_evictions": 0,
          "cold_failed_cleanups": 0,
          "cold_failed_copies": 0,
          "cold_generation_changes": 0,
          "cold_hits": 0,
          "cold_hot_refs": 0,
          "cold_misses": 0,
          "cold_peak_hot_refs": 0,
          "cold_peak_request_refs": 0,
          "cold_peak_transfer_refs": 0,
          "cold_request_refs": 0,
          "cold_requested_bytes": 0,
          "cold_slot_footprint": 0,
          "cold_slots": 0,
          "cold_source_bytes": 0,
          "cold_source_time_us": 0,
          "cold_transfer_refs": 0,
          "cold_unused_bytes": 0,
          "decode_tokens_per_second": 213.208,
          "disk_h2d_overlap_bytes": 0,
          "disk_h2d_overlap_events": 0,
          "disk_h2d_overlap_flights": 0,
          "disk_h2d_overlap_pair_digest": 0,
          "disk_h2d_overlap_pairs": 0,
          "disk_h2d_overlap_read_bytes": 0,
          "disk_h2d_overlap_read_flights": 0,
          "disk_h2d_overlap_transfer_flights": 0,
          "disk_h2d_overlap_us": 0,
          "execution_backend_device_type": -1,
          "execution_ids_backend_consistent": 1,
          "execution_ids_backend_device_type": -1,
          "execution_ids_backend_name": "",
          "execution_ids_cpu": 0,
          "execution_ids_non_cpu": 0,
          "h2d_compute_overlap_bytes": 0,
          "h2d_compute_overlap_flights": 0,
          "h2d_compute_overlap_us": 0,
          "h2d_compute_overlap_work": 0,
          "hot_admissions": 0,
          "hot_effective_capacity": 0,
          "hot_evictions": 0,
          "hot_hits": 0,
          "hot_misses": 0,
          "hot_requested_capacity": 0,
          "hot_slots": 0,
          "io_active_operations": 0,
          "io_active_requests": 0,
          "io_async": 0,
          "io_buffer_registration_error": 0,
          "io_buffered_fallback_bytes": 0,
          "io_buffered_fallback_operations": 0,
          "io_bytes": 0,
          "io_cq_entries": 0,
          "io_direct_aligned_bytes": 0,
          "io_direct_capability_retries": 0,
          "io_direct_operations": 0,
          "io_direct_scatter_bytes": 0,
          "io_direct_staging_error": 0,
          "io_direct_useful_bytes": 0,
          "io_file_registration_error": 0,
          "io_operations": 0,
          "io_peak_batch_requests": 0,
          "io_peak_cq_occupancy": 0,
          "io_peak_sq_occupancy": 0,
          "io_probe_error": 0,
          "io_registered_buffer_bytes": 0,
          "io_registered_buffers": 0,
          "io_registered_files": 0,
          "io_request_batches": 0,
          "io_requests": 0,
          "io_runtime_error": 0,
          "io_setup_error": 0,
          "io_sq_entries": 0,
          "io_sync_fallback_operations": 0,
          "io_trace_dropped": 0,
          "load_mode": "mmap",
          "logits_hash": 15593969896155122210,
          "mode": "disabled",
          "no_writeback_evictions": 0,
          "prompt_ids": "18805,308,799,5624,12524",
          "prompt_tokens_per_second": 74.0357,
          "provider_effective_capacity": 0,
          "provider_failures": 0,
          "provider_pool_bytes": 0,
          "provider_pool_generations": 0,
          "provider_tensor_copies": 0,
          "resident_runtime_quiet": 1,
          "ring_acquisition": "",
          "ring_actual_bytes": 0,
          "ring_async_enqueues": 0,
          "ring_compute_event_allocations": 0,
          "ring_compute_event_capacity": 0,
          "ring_compute_event_frees": 0,
          "ring_compute_event_records": 0,
          "ring_compute_event_syncs": 0,
          "ring_compute_waits": 0,
          "ring_compute_work": 0,
          "ring_dedicated_backend": 0,
          "ring_event_capable": 0,
          "ring_event_capacity": 0,
          "ring_event_records": 0,
          "ring_event_syncs": 0,
          "ring_fallback": 0,
          "ring_fallback_reason": "",
          "ring_first_h2d_us": 0,
          "ring_h2d_bytes": 0,
          "ring_h2d_event_allocations": 0,
          "ring_h2d_event_capacity": 0,
          "ring_h2d_event_frees": 0,
          "ring_h2d_time_us": 0,
          "ring_lane_footprint": 0,
          "ring_lanes": 0,
          "ring_last_h2d_complete_us": 0,
          "ring_live_compute_events": 0,
          "ring_live_events": 0,
          "ring_live_h2d_events": 0,
          "ring_peak_live_compute_events": 0,
          "ring_peak_live_events": 0,
          "ring_peak_live_h2d_events": 0,
          "ring_pinned_bytes": 0,
          "ring_requested_bytes": 0,
          "ring_stage_bytes": 0,
          "ring_stage_time_us": 0,
          "ring_sync_copies": 0,
          "ring_trace_capacity": 0,
          "ring_trace_dropped": 0,
          "ring_trace_records": 0,
          "ring_wave_syncs": 0,
          "ring_waves": 0,
          "route_hash": 7776629680536313001,
          "route_records": 63,
          "routing_backend_consistent": 1,
          "routing_backend_device_type": 2,
          "routing_backend_name": "CUDA0",
          "routing_ids_cpu": 0,
          "routing_ids_non_cpu": 63,
          "scheduler_active": 0,
          "scheduler_flights": 0,
          "source_pageable": 0,
          "source_pinned_bytes": 0,
          "storage_cancelled_reads": 0,
          "storage_direct_alignment": 0,
          "storage_direct_sources": 0,
          "storage_direct_unsupported": 0,
          "storage_integrity_checks": 0,
          "storage_integrity_mismatches": 0,
          "storage_io_errors": 0,
          "storage_poisoned": 0,
          "storage_read_bytes": 0,
          "storage_read_chunks": 0,
          "storage_read_requests": 0,
          "storage_short_reads": 0,
          "token_p50_us": 4600,
          "token_p95_us": 67535,
          "token_p99_us": 67535,
          "tokens": "318,57195,11,1459,387",
          "ttft_us": 67535
        },
        "stderr_sha256": "27e9a2bbe2f7d0c22e7aa0b5b95e8bc941e6c59359e6cacafb80ae82214ae531",
        "stdout_sha256": "375dd6adec3c27d59526909e43c1bd9851f99b95dee716f2fd27a7718c83d7ae"
      },
      "original_uma": {
        "command": [
          "/workspace/k3-out-of-core/llama.cpp/build-phase11-a-cuda/bin/phase11-uma-runtime-probe",
          "--model",
          "/workspace/k3-out-of-core/models/gguf/Kimi-K3-0.40B-F16.gguf",
          "--mode",
          "uma",
          "--steps",
          "5",
          "--capacity",
          "2",
          "--cold-bytes",
          "1572864",
          "--ring-bytes",
          "0"
        ],
        "diagnostics": {
          "cold_actual_bytes": 1572864,
          "cold_alignment": 4096,
          "cold_bundle_payload": 786432,
          "cold_evictions": 124,
          "cold_failed_cleanups": 0,
          "cold_failed_copies": 0,
          "cold_generation_changes": 126,
          "cold_hits": 0,
          "cold_hot_refs": 2,
          "cold_misses": 126,
          "cold_peak_hot_refs": 2,
          "cold_peak_request_refs": 2,
          "cold_peak_transfer_refs": 0,
          "cold_request_refs": 0,
          "cold_requested_bytes": 1572864,
          "cold_slot_footprint": 786432,
          "cold_slots": 2,
          "cold_source_bytes": 0,
          "cold_source_time_us": 0,
          "cold_transfer_refs": 0,
          "cold_unused_bytes": 0,
          "decode_tokens_per_second": 27.3248,
          "disk_h2d_overlap_bytes": 0,
          "disk_h2d_overlap_events": 0,
          "disk_h2d_overlap_flights": 0,
          "disk_h2d_overlap_pair_digest": 0,
          "disk_h2d_overlap_pairs": 0,
          "disk_h2d_overlap_read_bytes": 0,
          "disk_h2d_overlap_read_flights": 0,
          "disk_h2d_overlap_transfer_flights": 0,
          "disk_h2d_overlap_us": 0,
          "execution_backend_device_type": 2,
          "execution_ids_backend_consistent": 1,
          "execution_ids_backend_device_type": 0,
          "execution_ids_backend_name": "CPU",
          "execution_ids_cpu": 63,
          "execution_ids_non_cpu": 0,
          "h2d_compute_overlap_bytes": 0,
          "h2d_compute_overlap_flights": 0,
          "h2d_compute_overlap_us": 0,
          "h2d_compute_overlap_work": 0,
          "hot_admissions": 0,
          "hot_effective_capacity": 2,
          "hot_evictions": 0,
          "hot_hits": 0,
          "hot_misses": 0,
          "hot_requested_capacity": 2,
          "hot_slots": 0,
          "io_active_operations": 0,
          "io_active_requests": 0,
          "io_async": 0,
          "io_buffer_registration_error": 0,
          "io_buffered_fallback_bytes": 0,
          "io_buffered_fallback_operations": 0,
          "io_bytes": 0,
          "io_cq_entries": 0,
          "io_direct_aligned_bytes": 0,
          "io_direct_capability_retries": 0,
          "io_direct_operations": 0,
          "io_direct_scatter_bytes": 0,
          "io_direct_staging_error": 0,
          "io_direct_useful_bytes": 0,
          "io_file_registration_error": 0,
          "io_operations": 0,
          "io_peak_batch_requests": 0,
          "io_peak_cq_occupancy": 0,
          "io_peak_sq_occupancy": 0,
          "io_probe_error": 0,
          "io_registered_buffer_bytes": 0,
          "io_registered_buffers": 0,
          "io_registered_files": 0,
          "io_request_batches": 0,
          "io_requests": 0,
          "io_runtime_error": 0,
          "io_setup_error": 1,
          "io_sq_entries": 0,
          "io_sync_fallback_operations": 0,
          "io_trace_dropped": 0,
          "load_mode": "mmap",
          "logits_hash": 15593969896155122210,